{
  "packetVersion": "1.0",
  "briefFile": "00_MFD_COUNCIL_SHARED_BRIEF.md",
  "generatedAt": "2026-07-08",
  "workingRoot": "/Users/tkevinbigham/Downloads/MFD-main",
  "evidenceBasis": [
    {
      "kind": "brief",
      "file": "00_MFD_COUNCIL_SHARED_BRIEF.md",
      "lines": "1-131",
      "claim": "The council brief requires proposal scoring, complete gameplay-slice fields, evidence discipline, and use of schemas/MFD_COUNCIL_PROPOSAL_SCHEMA.json."
    },
    {
      "kind": "current_ledger",
      "file": "STATUS.md",
      "lines": "1-40",
      "claim": "The latest ledger records Patch 3.1 Team Window Read-Model and names Counterfactual FA/draft receipts as the best next slice."
    },
    {
      "kind": "current_ledger",
      "file": "RELEASE_CONVERGENCE.md",
      "lines": "1-47",
      "claim": "The current release ledger records CI release-gate wiring, green G1-G6 gates, and a remaining YELLOW G7 requiring one uninterrupted local pass plus remote proof."
    },
    {
      "kind": "current_source",
      "file": "packages/engine/src/config/difficulty.ts",
      "lines": "1-73",
      "claim": "The inspected source-truth save schema version is SAVE_VERSION = 36."
    }
  ],
  "gapTriage": [
    {
      "briefGap": "Full release gate is not enforced in CI/deploy.",
      "currentStatus": "partially-mitigated",
      "basis": "RELEASE_CONVERGENCE.md now says CI has a dependent release-gate job, but G7 remains YELLOW until one uninterrupted local 36/36 pass and one remote proof exist.",
      "proposalIds": ["g7-release-certificate"]
    },
    {
      "briefGap": "No clean 25- or 50-year quality certificate.",
      "currentStatus": "partially-mitigated",
      "basis": "CODEX_IMPROVEMENT_PLAN.md now records opt-in goat-25y/goat-50y profiles with 0 high anomalies, but the public release certificate still needs a current default gate and remote proof.",
      "proposalIds": ["g7-release-certificate"]
    },
    {
      "briefGap": "Draft war-room trade acceptance can desynchronize pick assets and draft order.",
      "currentStatus": "superseded",
      "basis": "packages/engine/src/systems/draft-war-room.ts now validates live assets and updates draft-order ownership; draft-war-room and store tests cover accepted offers and no-partial-apply behavior.",
      "proposalIds": []
    },
    {
      "briefGap": "Generated draft offers can reference assets that are not truly transferable.",
      "currentStatus": "superseded",
      "basis": "draftTradeCandidates filters to hasSourceDraftOrderPick, future assets come from owned team.draftPicks, and current tests cover source-backed offers.",
      "proposalIds": []
    },
    {
      "briefGap": ".mfd backups omit emotional browser-local sidecars.",
      "currentStatus": "superseded",
      "basis": "STATUS.md records Patch 0.3 Backup Trust making Combined Backup the primary portable export/import path and classic .mfd advanced current-save-only recovery.",
      "proposalIds": []
    },
    {
      "briefGap": "Several long-history save fields and game results remain permissively validated.",
      "currentStatus": "open",
      "basis": "packages/engine/src/save/schema.ts still contains z.any islands for ScheduledGame.result, franchiseHistory, playerArchive, eventLog, weekSummaries, playoffBracket, and related long-history fields.",
      "proposalIds": ["long-history-schema-hardening"]
    },
    {
      "briefGap": "CPU strategy exists but lacks a durable player-facing intent history.",
      "currentStatus": "partially-mitigated",
      "basis": "CODEX_IMPROVEMENT_PLAN.md records saved-field intent ledger, market receipts, strategy-history display, and Team Window read-model work. Durable cross-window history remains a future schema-backed option.",
      "proposalIds": ["shared-action-receipt-contract"]
    },
    {
      "briefGap": "Trick plays are planned but not consumed by live simulation.",
      "currentStatus": "open",
      "basis": "GamePlanSetup labels trick plays as planning only, and trick-plays tests still guard that game-sim does not import executeTrickPlay or shouldCallTrickPlay.",
      "proposalIds": ["trick-play-live-drive-integration"]
    },
    {
      "briefGap": "Position coaches affect progression but lack a hiring/development lifecycle.",
      "currentStatus": "superseded",
      "basis": "Current store and CoachingStaff source expose initializePositionCoachesForTeam and upgradePositionCoachRole; the status/plan ledger records position-coach commands and season rollover tenure.",
      "proposalIds": []
    },
    {
      "briefGap": "Press conferences store quotes without meaningful downstream effects.",
      "currentStatus": "open",
      "basis": "PressConferenceModal still says Public quote only and No gameplay change; respondToPressConference only writes selectedTier and selectedResponse.",
      "proposalIds": ["press-conference-low-stakes-consequence"]
    },
    {
      "briefGap": "Inbox read state is not durable.",
      "currentStatus": "open",
      "basis": "InboxTriage source rows say selectedMsg/filter are local only and durable read receipts remain outside the route until GameState exposes a saved receipt field.",
      "proposalIds": ["durable-inbox-read-receipts"]
    },
    {
      "briefGap": "Formation-aware lineup validation is incomplete.",
      "currentStatus": "open",
      "basis": "DepthChart currently counts starters by position targets; no formation package validation is surfaced in the inspected route slice.",
      "proposalIds": ["formation-aware-lineup-validation"]
    },
    {
      "briefGap": "Major actions do not share one consistent receipt contract.",
      "currentStatus": "partially-mitigated",
      "basis": "Many route-local receipts have shipped, but acceptTradeOffer still returns an EngineOutput with empty events and consequences after mutating rosters, news, social feed, and press conference queues.",
      "proposalIds": ["shared-action-receipt-contract"]
    },
    {
      "briefGap": "Existing progressive-nav metadata is not used to reduce overload.",
      "currentStatus": "partially-mitigated",
      "basis": "The UI/UX convergence ledger records exposing static routes and using navigation/unlock metadata; further progressive disclosure is product-tuning, not a top current risk.",
      "proposalIds": []
    },
    {
      "briefGap": "Dynasty memory is split among routes and sidecars.",
      "currentStatus": "partially-mitigated",
      "basis": "Combined backup, dynasty callbacks, session recap, draft follow-through, and Game Day player-arc callbacks reduce the split. Remaining memory work should be tied to specific routes or saved history schemas.",
      "proposalIds": ["long-history-schema-hardening"]
    },
    {
      "briefGap": "The game has lists and archives but does not consistently author era stories back to the player.",
      "currentStatus": "partially-mitigated",
      "basis": "Recent ledgers record callbacks/session recap and many read-model surfaces. This stays a later content/system compounding theme unless a concrete source gap is re-confirmed.",
      "proposalIds": []
    },
    {
      "briefGap": "Player arcs, grudges, agents, mentorships, injuries, playoff failures, and comeback seasons do not recur strongly enough at emotional moments.",
      "currentStatus": "not-ranked-now",
      "basis": "This is directionally valid, but the inspected current ledgers already shipped several callback/read-model slices. Rank concrete remaining source gaps after the higher-trust items.",
      "proposalIds": []
    },
    {
      "briefGap": "Direct-only history routes are easy to miss.",
      "currentStatus": "partially-mitigated",
      "basis": "UI/UX convergence exposed all static routes through the app shell and left only dynamic player routes contextual. Remaining CTAs should be event-specific.",
      "proposalIds": []
    }
  ],
  "proposals": [
    {
      "id": "trick-play-live-drive-integration",
      "title": "Trick Play Live-Drive Integration",
      "summary": "Consume the existing saved weekly-prep trick-play selections inside the live game drive loop with bounded frequency, seeded RNG, and a postgame receipt. This turns a high-emotion planning choice into a visible football consequence without adding a new save island.",
      "briefAlignment": ["consequence", "trust", "memory", "clarity"],
      "complexity": "M",
      "confidence": "high",
      "recommendedDisposition": "now",
      "scoring": {
        "playerImpact": 9,
        "trustImprovement": 7,
        "intelligenceExplainability": 3,
        "consequenceStrength": 9,
        "dynastyMemoryCompounding": 7,
        "reuseOfExistingSystems": 8,
        "technicalFeasibility": 6,
        "deterministicTestability": 7,
        "saveMigrationSafety": 8,
        "cognitiveLoadEffect": 7,
        "total": 71
      },
      "evidence": [
        {
          "kind": "audit",
          "file": "MFD_AI_SIM_AUDIT.md",
          "lines": "34-46",
          "claim": "Audit finding A02 says trick plays are not part of live game simulation.",
          "quotedSourceEvidence": "GamePlanSetup.tsx:626-627, trick-plays.test.ts:198-230"
        },
        {
          "kind": "current_source",
          "file": "apps/web/src/features/game-plan/GamePlanSetup.tsx",
          "lines": "138-146, 626-627",
          "claim": "The route labels trick-play count as planning-only and names executeTrickPlay and shouldCallTrickPlay as not live-drive consumers."
        },
        {
          "kind": "current_source",
          "file": "packages/engine/src/systems/trick-plays.ts",
          "lines": "188-267",
          "claim": "Existing deterministic helpers already execute trick plays and decide call frequency from injected RNG and game context."
        }
      ],
      "assumptions": [